{"bundle_sha256":"33aa7c6b0d557fa9a72e2fa4e0106493d8dfe10ec9201bd7762e204bb14a286d","client_session":"road04-verification","execution_id":"road-exec-33766f336d9cc18eb2ac159e","final_qa":false,"layer_ids":["nma-road-label-road-exec-33766f336d9cc18eb2ac159e"],"loaded_candidate_representation":true,"observation_id":"road-observation-4c88e2e424168c1c712145c1","observation_sha256":"e5263aa67dbb400e0c3a63b7cd1457d9d95428a8d519aef34b3c9b4396ce1d9a","observed_feature_count":3,"runtime_version":"maplibre-reviewed-line-mechanism/1","schema":"nma.road-runtime-observation/1.0","source_ids":["nma-road-source-road-exec-33766f336d9cc18eb2ac159e"],"state":"verify","status":"verified","timestamp":"2026-08-19T12:00:00Z"}
